NEXT-GENERATION SEQUENCING IMPROVES THE DETECTION OF MALIGNANT BILIARY STRICTURES AND CHANGES MANAGEMENT,https://eposters.ddw.org/ddw/2023/ddw-2023/377693/olgert.bardhi.next-generation.sequencing.improves.the.detection.of.malignant.html?f=menu%3D16%2Abrowseby%3D8%2Asortby%3D2%2Ace_id%3D2482%2Aot_id%3D27743%2Atrend%3D19514%2Amarker%3D4154,"Bardhi O. May 8, 2023; Mo1132"
THE ROLE OF LIVER TRANSPLANT IN THE DEVELOPMENT OF COLORECTAL DYSPLASIA IN PATIENTS WITH PSC-IBD,https://eposters.ddw.org/ddw/2023/ddw-2023/377694/alexandra.weiss.the.role.of.liver.transplant.in.the.development.of.colorectal.html?f=menu%3D16%2Abrowseby%3D8%2Asortby%3D2%2Ace_id%3D2482%2Aot_id%3D27743%2Atrend%3D19514%2Amarker%3D4154,"Weiss A. May 8, 2023; Mo1133"
THE NEW AGE? ROLE OF SERUM BIOMARKERS FOR HEPATITIS B ASSOCIATED HEPATOCELLULAR CARCINOMA AND THE PREVALENCE OF...,https://eposters.ddw.org/ddw/2023/ddw-2023/377695/ngozi.nwude.the.new.age.role.of.serum.biomarkers.for.hepatitis.b.associated.html?f=menu%3D16%2Abrowseby%3D8%2Asortby%3D2%2Ace_id%3D2482%2Aot_id%3D27743%2Atrend%3D19514%2Amarker%3D4154,"nwude N. May 8, 2023; Mo1134"
SPATIAL TRANSCRIPTOMIC ANALYSIS OF INTRADUCTAL PAPILLARY MUCINOUS NEOPLASMS IDENTIFIES POTENTIAL BIOMARKERS OF...,https://eposters.ddw.org/ddw/2023/ddw-2023/377698/jay.li.spatial.transcriptomic.analysis.of.intraductal.papillary.mucinous.html?f=menu%3D16%2Abrowseby%3D8%2Asortby%3D2%2Ace_id%3D2482%2Aot_id%3D27743%2Atrend%3D19514%2Amarker%3D4154,"Li J. May 8, 2023; Mo1137"
COMPARATIVE PROTEOMICS REVEALS TRANSLATIONAL POTENTIAL OF TARGETS FOR PANCREATIC DUCTAL ADENOCARCINOMA,https://eposters.ddw.org/ddw/2023/ddw-2023/377699/mathilde.resell.comparative.proteomics.reveals.translational.potential.of.html?f=menu%3D16%2Abrowseby%3D8%2Asortby%3D2%2Ace_id%3D2482%2Aot_id%3D27743%2Atrend%3D19514%2Amarker%3D4154,"Resell M. May 8, 2023; Mo1138"
A CIRCRNA-BASED LIQUID BIOPSY ASSAY FOR THE NONINVASIVE AND EARLY DETECTION OF PANCREATIC DUCTAL ADENOCARCINOMA:...,https://eposters.ddw.org/ddw/2023/ddw-2023/377700/caiming.xu.a.circrna-based.liquid.biopsy.assay.for.the.noninvasive.and.early.html?f=menu%3D16%2Abrowseby%3D8%2Asortby%3D2%2Ace_id%3D2482%2Aot_id%3D27743%2Atrend%3D19514%2Amarker%3D4154,"XU C. May 8, 2023; Mo1139"
APPROACH TO PRECISION MEDICINE FOR PANCREATIC DUCTAL ADENOCARCINOMA USING PATIENT-DERIVED ORGANOIDS,https://eposters.ddw.org/ddw/2023/ddw-2023/377702/kazuhide.matsumoto.approach.to.precision.medicine.for.pancreatic.ductal.html?f=menu%3D16%2Abrowseby%3D8%2Asortby%3D2%2Ace_id%3D2482%2Aot_id%3D27743%2Atrend%3D19514%2Amarker%3D4154,"Matsumoto K. May 8, 2023; Mo1141"
MACHINE LEARNING-BASED MODEL FOR PREDICTION AND FEATURE ANALYSIS OF RECURRENCE IN PANCREATIC NEUROENDOCRINE...,https://eposters.ddw.org/ddw/2023/ddw-2023/377703/masatoshi.murakami.machine.learning-based.model.for.prediction.and.feature.html?f=menu%3D16%2Abrowseby%3D8%2Asortby%3D2%2Ace_id%3D2482%2Aot_id%3D27743%2Atrend%3D19514%2Amarker%3D4154,"Murakami M. May 8, 2023; Mo1142"
SYNERGISTIC ANTITUMOR EFFICACY OF GEMCITABINE AND CISPLATIN TO INDUCE FERROPTOSIS IN PANCREATIC DUCTAL...,https://eposters.ddw.org/ddw/2023/ddw-2023/377704/wanhui.wei.synergistic.antitumor.efficacy.of.gemcitabine.and.cisplatin.to.html?f=menu%3D16%2Abrowseby%3D8%2Asortby%3D2%2Ace_id%3D2482%2Aot_id%3D27743%2Atrend%3D19514%2Amarker%3D4154,"Wei W. May 8, 2023; Mo1143"
DECREASED EXPRESSION OF HISTONE DEACETYLASE 4 (HDAC4) AND YES-ASSOCIATED PROTEIN 1 (YAP) IN IMMUNOSUPPRESSIVE...,https://eposters.ddw.org/ddw/2023/ddw-2023/377705/omer.elmadbouh.decreased.expression.of.histone.deacetylase.4.28hdac429.and.html?f=menu%3D16%2Abrowseby%3D8%2Asortby%3D2%2Ace_id%3D2482%2Aot_id%3D27743%2Atrend%3D19514%2Amarker%3D4154,"Elmadbouh O. May 8, 2023; Mo1144"
EXOSOMAL MIR-199A-3P SECRETED FROM CANCER-ASSOCIATED ADIPOCYTES PROMOTE PANCREATIC CANCER PROGRESSION,https://eposters.ddw.org/ddw/2023/ddw-2023/377706/yasushi.sato.exosomal.mir-199a-3p.secreted.from.cancer-associated.adipocytes.html?f=menu%3D16%2Abrowseby%3D8%2Asortby%3D2%2Ace_id%3D2482%2Aot_id%3D27743%2Atrend%3D19514%2Amarker%3D4154,"Sato Y. May 8, 2023; Mo1145"
ARE THERE NEW PRACTICAL MARKERS TO PREDICT MALIGNANCY IN PANCREATIC CYST FLUIDS?,https://eposters.ddw.org/ddw/2023/ddw-2023/377707/filiz.akyuz.are.there.new.practical.markers.to.predict.malignancy.in.html?f=menu%3D16%2Abrowseby%3D8%2Asortby%3D2%2Ace_id%3D2482%2Aot_id%3D27743%2Atrend%3D19514%2Amarker%3D4154,"Akyuz F. May 8, 2023; Mo1146"
GENETIC TESTING UPTAKE AND PANCREATIC CANCER SURVEILLANCE AMONG RELATIVES OF HIGH-RISK INDIVIDUALS,https://eposters.ddw.org/ddw/2023/ddw-2023/377708/ophir.gilad.genetic.testing.uptake.and.pancreatic.cancer.surveillance3Cbr3E.html?f=menu%3D16%2Abrowseby%3D8%2Asortby%3D2%2Ace_id%3D2482%2Aot_id%3D27743%2Atrend%3D19514%2Amarker%3D4154,"Gilad O. May 8, 2023; Mo1147"
"EXOCRINE PANCREAS INSUFFICIENCY, PREDIABETES, DIABETES MELLITUS, AND THE INCIDENCE OF PANCREATIC ADENOCARCINOMA:...",https://eposters.ddw.org/ddw/2023/ddw-2023/377709/oyedotun.babajide.exocrine.pancreas.insufficiency.prediabetes.diabetes.html?f=menu%3D16%2Abrowseby%3D8%2Asortby%3D2%2Ace_id%3D2482%2Aot_id%3D27743%2Atrend%3D19514%2Amarker%3D4154,"Babajide O. May 8, 2023; Mo1148"
RATE AND CHARACTERISTICS OF INTERVAL COLORECTAL CANCER DIAGNOSES IN PATIENTS WITH LYNCH SYNDROME,https://eposters.ddw.org/ddw/2023/ddw-2023/377711/joshua.smith.rate.and.characteristics.of.interval.colorectal.cancer.diagnoses.html?f=menu%3D16%2Abrowseby%3D8%2Asortby%3D2%2Ace_id%3D2482%2Aot_id%3D27743%2Atrend%3D19514%2Amarker%3D4154,"Smith J. May 8, 2023; Mo1150"
OUTCOMES OF GASTRIC CANCER SURVEILLANCE IN LYNCH SYNDROME,https://eposters.ddw.org/ddw/2023/ddw-2023/377714/nadeen.sarsour.outcomes.of.gastric.cancer.surveillance.in.lynch.syndrome.html?f=menu%3D16%2Abrowseby%3D8%2Asortby%3D2%2Ace_id%3D2482%2Aot_id%3D27743%2Atrend%3D19514%2Amarker%3D4154,"Sarsour N. May 8, 2023; Mo1153"
PREVALENCE OF GASTRIC INTESTINAL METAPLASIA AND H. PYLORI ON SURVEILLANCE UPPER ENDOSCOPY IN LYNCH SYNDROME,https://eposters.ddw.org/ddw/2023/ddw-2023/377716/marya.pulaski.prevalence.of.gastric.intestinal.metaplasia.and.3Ci3Eh.pylori3C.i3E.html?f=menu%3D16%2Abrowseby%3D8%2Asortby%3D2%2Ace_id%3D2482%2Aot_id%3D27743%2Atrend%3D19514%2Amarker%3D4154,"Pulaski M. May 8, 2023; Mo1155"
A RARE CASE OF LYNCH SYNDROME WITH MULTIPLE SMALL BOWEL CANCERS,https://eposters.ddw.org/ddw/2023/ddw-2023/377717/madeline.weber.a.rare.case.of.lynch.syndrome.with.multiple.small.bowel.cancers.html?f=menu%3D16%2Abrowseby%3D8%2Asortby%3D2%2Ace_id%3D2482%2Aot_id%3D27743%2Atrend%3D19514%2Amarker%3D4154,"Weber M. May 8, 2023; Mo1156"
CHARACTERIZING UNIQUE MICROBIOME ALLTERATIONS IN LYNCH SYNDROME WITHIN THE DRUZE COMMUNITY IN ISRAEL,https://eposters.ddw.org/ddw/2023/ddw-2023/377718/elizabeth.half.3Cbr3E.characterizing.unique.microbiome.allterations.in.lynch.html?f=menu%3D16%2Abrowseby%3D8%2Asortby%3D2%2Ace_id%3D2482%2Aot_id%3D27743%2Atrend%3D19514%2Amarker%3D4154,"Half E. May 8, 2023; Mo1157"
DIFFERENCES IN PRESENTATION AND TREATMENT BETWEEN SPORADIC AND FAMILIAL ADENOMATOUS POLYPOSIS (FAP) RELATED...,https://eposters.ddw.org/ddw/2023/ddw-2023/377719/mohamad.othman.el.helou.differences.in.presentation.and.treatment.between.html?f=menu%3D16%2Abrowseby%3D8%2Asortby%3D2%2Ace_id%3D2482%2Aot_id%3D27743%2Atrend%3D19514%2Amarker%3D4154,"El Helou M. May 8, 2023; Mo1158"
CLINICOPATHOLOGICAL FEATURES ASSOCIATED WITH SIGNET RING CELL CARCINOMA ON ENDOSCOPIC BIOPSIES IN CDH1 ...,https://eposters.ddw.org/ddw/2023/ddw-2023/377722/ophir.gilad.clinicopathological.features.associated.with.signet.ring.cell.html?f=menu%3D16%2Abrowseby%3D8%2Asortby%3D2%2Ace_id%3D2482%2Aot_id%3D27743%2Atrend%3D19514%2Amarker%3D4154,"Gilad O. May 8, 2023; Mo1161"
GUT MICROBIOME AND RESISTOME HOMECOMING: THE MICROBES AND ANTIBIOTIC RESISTANCE GENES WE GAIN AND LOSE DURING...,https://eposters.ddw.org/ddw/2023/ddw-2023/377734/zhen.ye.sin.gut.microbiome.and.resistome.homecoming.the.microbes.and.html?f=menu%3D16%2Abrowseby%3D8%2Asortby%3D2%2Ace_id%3D2482%2Aot_id%3D27743%2Atrend%3D19514%2Amarker%3D4154,"Sin Z. May 8, 2023; Mo1173"
NICHE OF COMMENSAL BACTERIA IS RE-DIRECTED BY HOST IMMUNITY IN UPPER SMALL INTESTINE AND BACTERIAL COMPETITION...,https://eposters.ddw.org/ddw/2023/ddw-2023/377732/sano.teruyuki.niche.of.commensal.bacteria.is.re-directed.by.host.immunity.in.html?f=menu%3D16%2Abrowseby%3D8%2Asortby%3D2%2Ace_id%3D2482%2Aot_id%3D27743%2Atrend%3D19514%2Amarker%3D4154,"Teruyuki S. May 8, 2023; Mo1171"
A VANISHING FAMILY OF COMMENSAL BACTERIA AND ITS IMPACT ON HOST HEALTH AND DISEASE,https://eposters.ddw.org/ddw/2023/ddw-2023/377730/deanna.pepin.a.vanishing.family.of.commensal.bacteria.and.its.impact.on.host.html?f=menu%3D16%2Abrowseby%3D8%2Asortby%3D2%2Ace_id%3D2482%2Aot_id%3D27743%2Atrend%3D19514%2Amarker%3D4154,"Pepin D. May 8, 2023; Mo1169"
HYPERBILIRUBINEMIA-ASSOCIATED CHANGES OF LIVER-GUT INTERACTIONS INFLUENCE THE GUT MICROBIOTA,https://eposters.ddw.org/ddw/2023/ddw-2023/377728/anika.sander.hyperbilirubinemia-associated.changes.of.liver-gut.interactions.html?f=menu%3D16%2Abrowseby%3D8%2Asortby%3D2%2Ace_id%3D2482%2Aot_id%3D27743%2Atrend%3D19514%2Amarker%3D4154,"Sander A. May 8, 2023; Mo1167"
LOW PREVALENCE OF H. PYLORI AND GASTRIC INTESTINAL METAPLASIA IN BRCA1/2 CARRIERS UNDERGOING EUS,https://eposters.ddw.org/ddw/2023/ddw-2023/377727/bryson.katona.low.prevalence.of.3Ci3Eh.pylori3C.i3E.and.gastric.intestinal.html?f=menu%3D16%2Abrowseby%3D8%2Asortby%3D2%2Ace_id%3D2482%2Aot_id%3D27743%2Atrend%3D19514%2Amarker%3D4154,"Katona B. May 8, 2023; Mo1166"
METABOLIC PARAMETERS PREDICTIVE OF IMAGING FEATURES ASSOCIATED WITH NEOPLASTIC PROGRESSION IN A PANCREATIC...,https://eposters.ddw.org/ddw/2023/ddw-2023/377726/michael.hill-oliva.metabolic.parameters.predictive.of.imaging.features.html?f=menu%3D16%2Abrowseby%3D8%2Asortby%3D2%2Ace_id%3D2482%2Aot_id%3D27743%2Atrend%3D19514%2Amarker%3D4154,"Hill-Oliva M. May 8, 2023; Mo1165"
EXPANSION IN POPULATIONS ELIGIBLE FOR SCREENING FOR PANCREATIC CANCER IN BRCA1/2 MUTATION CARRIERS,https://eposters.ddw.org/ddw/2023/ddw-2023/377724/tavia.buysse.expansion.in.populations.eligible.for.screening.for.pancreatic.html?f=menu%3D16%2Abrowseby%3D8%2Asortby%3D2%2Ace_id%3D2482%2Aot_id%3D27743%2Atrend%3D19514%2Amarker%3D4154,"Buysse T. May 8, 2023; Mo1163"
GASTRIC NEOPLASMS IN FAMILIAL ADENOMATOUS POLYPOSIS: A SYSTEMATIC REVIEW AND META-ANALYSIS,https://eposters.ddw.org/ddw/2023/ddw-2023/377720/syed.hamaad.rahman.gastric.neoplasms.in.familial.adenomatous.polyposis.a.html?f=menu%3D16%2Abrowseby%3D8%2Asortby%3D2%2Ace_id%3D2482%2Aot_id%3D27743%2Atrend%3D19514%2Amarker%3D4154,"Rahman S. May 8, 2023; Mo1159"
IS GASTRIC CANCER SCREENING NECESSARY IN LYNCH SYNDROME?,https://eposters.ddw.org/ddw/2023/ddw-2023/377715/leticia.moreira.is.gastric.cancer.screening.necessary.in.lynch.syndrome.html?f=menu%3D16%2Abrowseby%3D8%2Asortby%3D2%2Ace_id%3D2482%2Aot_id%3D27743%2Atrend%3D19514%2Amarker%3D4154,"Moreira L. May 8, 2023; Mo1154"
COLORECTAL ADENOMA PREVALENCE AND INCIDENCE IN LYNCH SYNDROME BY GENE,https://eposters.ddw.org/ddw/2023/ddw-2023/377712/leticia.moreira.colorectal.adenoma.prevalence.and.incidence.in.lynch.syndrome.html?f=menu%3D16%2Abrowseby%3D8%2Asortby%3D2%2Ace_id%3D2482%2Aot_id%3D27743%2Atrend%3D19514%2Amarker%3D4154,"Moreira L. May 8, 2023; Mo1151"
RADIOLOGIC ANALYSIS FOR RISK STRATIFICATION OF HEPATOCELLULAR CARCINOMA IN PATIENTS WITH CIRRHOSIS,https://eposters.ddw.org/ddw/2023/ddw-2023/377696/linda.azab.radiologic.analysis.for.risk.stratification.of.hepatocellular.html?f=menu%3D16%2Abrowseby%3D8%2Asortby%3D2%2Ace_id%3D2482%2Aot_id%3D27743%2Atrend%3D19514%2Amarker%3D4154,"Azab L. May 8, 2023; Mo1135"
THE COST OF QUALITY IN THE PROVISION OF COLONOSCOPY SERVICES AT A LARGE TERTIARY HOSPITAL IN SOUTHEAST QUEENSLAND,https://eposters.ddw.org/ddw/2023/ddw-2023/377633/sahar.pakneshan.the.cost.of.quality.in.the.provision.of.colonoscopy.services.html?f=menu%3D16%2Abrowseby%3D8%2Asortby%3D2%2Ace_id%3D2482%2Aot_id%3D27743%2Atrend%3D19514%2Amarker%3D4154,"Pakneshan S. May 8, 2023; Mo1072"
TC-325 (HEMOSPRAY TM ) ALONE IS MORE EFFICACIOUS THAN STANDARD ENDOSCOPIC HEMOSTATIC MODALITIES WHEN...,https://eposters.ddw.org/ddw/2023/ddw-2023/377634/alan.barkun.tc-325.28hemospray3Csup3Etm3C.sup3E29.alone.is.more.efficacious.than.html?f=menu%3D16%2Abrowseby%3D8%2Asortby%3D2%2Ace_id%3D2482%2Aot_id%3D27743%2Atrend%3D19514%2Amarker%3D4154,"Barkun A. May 8, 2023; Mo1073"
SINGLE CENTER WESTERN EXPERIENCE: COMPARISON OF ESD AND FORCEPS BIOPSY FINDINGS FOR GASTRIC LESIONS,https://eposters.ddw.org/ddw/2023/ddw-2023/377635/daniel.scanlon.single.center.western.experience.comparison.of.esd.and.forceps.html?f=menu%3D16%2Abrowseby%3D8%2Asortby%3D2%2Ace_id%3D2482%2Aot_id%3D27743%2Atrend%3D19514%2Amarker%3D4154,"Scanlon D. May 8, 2023; Mo1074"
AMBULATORY ENDOSCOPIC SUBMUCOSAL DISSECTION FOR GASTROINTESTINAL NEOPLASMS: TRENDS AND ASSOCIATED FACTORS IN THE US,https://eposters.ddw.org/ddw/2023/ddw-2023/377636/youngil.kim.ambulatory.endoscopic.submucosal.dissection.for.gastrointestinal.html?f=menu%3D16%2Abrowseby%3D8%2Asortby%3D2%2Ace_id%3D2482%2Aot_id%3D27743%2Atrend%3D19514%2Amarker%3D4154,"KIM Y. May 8, 2023; Mo1075"
"ENDOSCOPIC MANAGMENT OF SUBEPITHELIAL TUMORS (SETS) USING ENDOSCOPIC DISSECTION, ENDOSCOPIC FULL THICKNESS...",https://eposters.ddw.org/ddw/2023/ddw-2023/377637/shaleen.vasavada.endoscopic.managment.of.subepithelial.tumors.28sets29.using.html?f=menu%3D16%2Abrowseby%3D8%2Asortby%3D2%2Ace_id%3D2482%2Aot_id%3D27743%2Atrend%3D19514%2Amarker%3D4154,"Vasavada S. May 8, 2023; Mo1076"
DOUBLE BALLOON ENTEROSCOPY IN PATIENTS WITH HEREDITARY HEMORRHAGIC TELANGIECTASIA: A LARGE CASE SERIES,https://eposters.ddw.org/ddw/2023/ddw-2023/377638/sophie.goldman.double.balloon.enteroscopy.in.patients.with.hereditary.html?f=menu%3D16%2Abrowseby%3D8%2Asortby%3D2%2Ace_id%3D2482%2Aot_id%3D27743%2Atrend%3D19514%2Amarker%3D4154,"Goldman S. May 8, 2023; Mo1077"
PREDICTORS OF CLINICAL RESPONSE TO GASTRIC PER-ORAL ENDOSCOPIC MYOTOMY (G-POEM) IN PATIENTS WITH REFRACTORY...,https://eposters.ddw.org/ddw/2023/ddw-2023/377639/hashem.al.bunni.predictors.of.clinical.response.to.gastric.per-oral.endoscopic.html?f=menu%3D16%2Abrowseby%3D8%2Asortby%3D2%2Ace_id%3D2482%2Aot_id%3D27743%2Atrend%3D19514%2Amarker%3D4154,"Al Bunni H. May 8, 2023; Mo1078"
PREDICTORS OF RADIATION EXPOSURE IN ERCP FOR CHOLEDOCHOLITHIASIS: A MULTI-INSTITUTIONAL RETROSPECTIVE STUDY AT...,https://eposters.ddw.org/ddw/2023/ddw-2023/377640/daniel.marino.predictors.of.radiation.exposure.in.ercp.for.choledocholithiasis.html?f=menu%3D16%2Abrowseby%3D8%2Asortby%3D2%2Ace_id%3D2482%2Aot_id%3D27743%2Atrend%3D19514%2Amarker%3D4154,"Marino D. May 8, 2023; Mo1079"
"AGE AND BMI, BUT NOT GENDER, IMPACT RADIATION EXPOSURE DURATION DURING ERCP: RESULTS FROM A MULTICENTRIC SAMPLE",https://eposters.ddw.org/ddw/2023/ddw-2023/377641/mouhand.mohamed.age.and.bmi.but.not.gender.impact.radiation.exposure.duration.html?f=menu%3D16%2Abrowseby%3D8%2Asortby%3D2%2Ace_id%3D2482%2Aot_id%3D27743%2Atrend%3D19514%2Amarker%3D4154,"Mohamed M. May 8, 2023; Mo1080"
UNIFIED MAGNIFYING ENDOSCOPIC CLASSIFICATION (UMEC): A NORTH AMERICAN EDUCATION STUDY,https://eposters.ddw.org/ddw/2023/ddw-2023/377622/yusuke.fujiyoshi.unified.magnifying.endoscopic.classification.28umec29.a.north.html?f=menu%3D16%2Abrowseby%3D8%2Asortby%3D2%2Ace_id%3D2482%2Aot_id%3D27743%2Atrend%3D19514%2Amarker%3D4154,"Fujiyoshi Y. May 8, 2023; Mo1061"
SHORT-TERM AND LONG-TERM OUTCOME OF ENDOSCOPIC RESECTION AND TRANSORAL VIDEOLALYNGOSCOPIC SURGERY FOR...,https://eposters.ddw.org/ddw/2023/ddw-2023/377643/reona.kawamura.short-term.and.long-term.outcome.of.endoscopic.resection.and.html?f=menu%3D16%2Abrowseby%3D8%2Asortby%3D2%2Ace_id%3D2482%2Aot_id%3D27743%2Atrend%3D19514%2Amarker%3D4154,"Kawamura R. May 8, 2023; Mo1082"
"POLYPECTOMY PRACTICES IN REMOVAL OF DIMINUTIVE POLYPS AT AN ACADEMIC, TEACHING HOSPITAL",https://eposters.ddw.org/ddw/2023/ddw-2023/377644/neil.mehta.polypectomy.practices.in.removal.of.diminutive.polyps.at.an.html?f=menu%3D16%2Abrowseby%3D8%2Asortby%3D2%2Ace_id%3D2482%2Aot_id%3D27743%2Atrend%3D19514%2Amarker%3D4154,"Mehta N. May 8, 2023; Mo1083"
A PROSPECTIVE SINGLE-CENTRE STUDY OF TRANSMUCOSAL DIVERTICULAR MYOTOMY FOR THE TREATMENT OF THORACIC OESOPHAGEAL...,https://eposters.ddw.org/ddw/2023/ddw-2023/377645/sunil.gupta.a.prospective.single-centre.study.of.transmucosal.diverticular.html?f=menu%3D16%2Abrowseby%3D8%2Asortby%3D2%2Ace_id%3D2482%2Aot_id%3D27743%2Atrend%3D19514%2Amarker%3D4154,"Gupta S. May 8, 2023; Mo1084"
COMPLETE CHOLEDOCHOLITHIASIS CLEARANCE RATES AS A METRIC FOR ERCP COMPETENCY,https://eposters.ddw.org/ddw/2023/ddw-2023/377646/jeff.angelo.taclob.complete.choledocholithiasis.clearance.rates.as.a.metric.html?f=menu%3D16%2Abrowseby%3D8%2Asortby%3D2%2Ace_id%3D2482%2Aot_id%3D27743%2Atrend%3D19514%2Amarker%3D4154,"Taclob J. May 8, 2023; Mo1085"
AN ANALYSIS OF MORTALITY AND CLINICAL OUTCOMES IN PATIENTS UNDERGOING ERCP WITH RESPECT TO PROCEDURE TIMING - A...,https://eposters.ddw.org/ddw/2023/ddw-2023/377647/christopher.chhoun.an.analysis.of.mortality.and.clinical.outcomes.in.patients.html?f=menu%3D16%2Abrowseby%3D8%2Asortby%3D2%2Ace_id%3D2482%2Aot_id%3D27743%2Atrend%3D19514%2Amarker%3D4154,"Chhoun C. May 8, 2023; Mo1086"
UNPLANNED REPEAT ERCP AS A QUALITY INDICATOR,https://eposters.ddw.org/ddw/2023/ddw-2023/377648/melissa.chai.unplanned.repeat.ercp.as.a.quality.indicator.html?f=menu%3D16%2Abrowseby%3D8%2Asortby%3D2%2Ace_id%3D2482%2Aot_id%3D27743%2Atrend%3D19514%2Amarker%3D4154,"Chai M. May 8, 2023; Mo1087"
LEVERAGING ELECTRONIC HEALTH RECORD FUNCTIONALITY TO FACILITATE PRACTICAL MEASUREMENT OF COLONOSCOPY QUALITY...,https://eposters.ddw.org/ddw/2023/ddw-2023/377649/irvin.ma.leveraging.electronic.health.record.functionality.to.facilitate.html?f=menu%3D16%2Abrowseby%3D8%2Asortby%3D2%2Ace_id%3D2482%2Aot_id%3D27743%2Atrend%3D19514%2Amarker%3D4154,"Ma I. May 8, 2023; Mo1088"
ENDOSCOPIC INTERVENTION AFTER ABDOMINAL TRAUMA: A SINGLE-CENTER PERSPECTIVE,https://eposters.ddw.org/ddw/2023/ddw-2023/377650/ankur.patel.endoscopic.intervention.after.abdominal.trauma.a.single-center.html?f=menu%3D16%2Abrowseby%3D8%2Asortby%3D2%2Ace_id%3D2482%2Aot_id%3D27743%2Atrend%3D19514%2Amarker%3D4154,"Patel A. May 8, 2023; Mo1089"
FEASIBILITY AND EFFECTIVENESS OF ENDOSCOPIC SUTURING USING THE OVERSTITCH SUTURING DEVICE FOR GASTROINTESTINAL...,https://eposters.ddw.org/ddw/2023/ddw-2023/377632/mohammad.shaear.feasibility.and.effectiveness.of.endoscopic.suturing.using.the.html?f=menu%3D16%2Abrowseby%3D8%2Asortby%3D2%2Ace_id%3D2482%2Aot_id%3D27743%2Atrend%3D19514%2Amarker%3D4154,"Shaear M. May 8, 2023; Mo1071"
A RETROSPECTIVE EVALUATION OF EXTENDED ORAL SULFATE TABLET BOWEL PREPARATION DOSING,https://eposters.ddw.org/ddw/2023/ddw-2023/377631/john.mcgowan.a.retrospective.evaluation.of.extended.oral.sulfate.tablet.bowel.html?f=menu%3D16%2Abrowseby%3D8%2Asortby%3D2%2Ace_id%3D2482%2Aot_id%3D27743%2Atrend%3D19514%2Amarker%3D4154,"McGowan J. May 8, 2023; Mo1070"
COMPARISON OF OUTCOMES BETWEEN URGENT AND DELAYED ENDOSCOPY IN A MULTI-CENTER COHORT OF PATIENTS WITH REPEATED...,https://eposters.ddw.org/ddw/2023/ddw-2023/377630/taylor.geisman.comparison.of.outcomes.between.urgent.and.delayed.endoscopy.in.html?f=menu%3D16%2Abrowseby%3D8%2Asortby%3D2%2Ace_id%3D2482%2Aot_id%3D27743%2Atrend%3D19514%2Amarker%3D4154,"Geisman T. May 8, 2023; Mo1069"
CONCORDANCE BETWEEN GASTROINTESTINAL ENDOSCOPISTS AND BARIATRIC SURGEONS IN THE DIAGNOSIS OF SMALL HIATAL HERNIA,https://eposters.ddw.org/ddw/2023/ddw-2023/377629/darine.daher.concordance.between.gastrointestinal.endoscopists.and.bariatric.html?f=menu%3D16%2Abrowseby%3D8%2Asortby%3D2%2Ace_id%3D2482%2Aot_id%3D27743%2Atrend%3D19514%2Amarker%3D4154,"Daher D. May 8, 2023; Mo1068"
CONVENTIONAL ENDOSCOPIC MUCOSAL RESECTION VERSUS MODIFIED ENDOSCOPIC MUCOSAL RESECTION FOR DUODENAL...,https://eposters.ddw.org/ddw/2023/ddw-2023/377628/jin.hee.noh.conventional.endoscopic.mucosal.resection.versus.modified.html?f=menu%3D16%2Abrowseby%3D8%2Asortby%3D2%2Ace_id%3D2482%2Aot_id%3D27743%2Atrend%3D19514%2Amarker%3D4154,"Noh J. May 8, 2023; Mo1067"
MARIJUANA AND ENDOSCOPY: THE EFFECTS OF MARIJUANA ON ENDOSCOPY,https://eposters.ddw.org/ddw/2023/ddw-2023/377627/justin.kosirog.marijuana.and.endoscopy.the.effects.of.marijuana.on.endoscopy.html?f=menu%3D16%2Abrowseby%3D8%2Asortby%3D2%2Ace_id%3D2482%2Aot_id%3D27743%2Atrend%3D19514%2Amarker%3D4154,"Kosirog J. May 8, 2023; Mo1066"
PREVALENCE OF SYMPTOMS AND POSITIVE PROVOCATIVE TESTING FOR UPPER EXTREMITY REPETITIVE USE INJURIES IN...,https://eposters.ddw.org/ddw/2023/ddw-2023/377626/john.fang.prevalence.of.symptoms.and.positive.provocative.testing.for.upper.html?f=menu%3D16%2Abrowseby%3D8%2Asortby%3D2%2Ace_id%3D2482%2Aot_id%3D27743%2Atrend%3D19514%2Amarker%3D4154,"Fang J. May 8, 2023; Mo1065"
REMOVAL OF BROKEN AND PROXIMALLY MIGRATED PANCREATIC STENTS: A CASE SERIES,https://eposters.ddw.org/ddw/2023/ddw-2023/377625/ahamed.khalyfa.removal.of.broken.and.proximally.migrated.pancreatic.stents.a.html?f=menu%3D16%2Abrowseby%3D8%2Asortby%3D2%2Ace_id%3D2482%2Aot_id%3D27743%2Atrend%3D19514%2Amarker%3D4154,"Khalyfa A. May 8, 2023; Mo1064"
"OUTCOMES OF UPPER GASTROINTESTINAL BLEEDING AT UNITED STATES TEACHING AND NON-TEACHING HOSPITAL, NATIONAL...",https://eposters.ddw.org/ddw/2023/ddw-2023/377624/mohamad.sharbatji.outcomes.of.upper.gastrointestinal.bleeding.at.united.states.html?f=menu%3D16%2Abrowseby%3D8%2Asortby%3D2%2Ace_id%3D2482%2Aot_id%3D27743%2Atrend%3D19514%2Amarker%3D4154,"Sharbatji M. May 8, 2023; Mo1063"
IDENTIFICATION OF 6 KEY FEATURES OF COLORECTAL POLYPS INCREASES THE SENSITIVITY OF CANCER DETECTION AND ABILITY...,https://eposters.ddw.org/ddw/2023/ddw-2023/377623/lynn.debels.identification.of.6.key.features.of.colorectal.polyps.increases.html?f=menu%3D16%2Abrowseby%3D8%2Asortby%3D2%2Ace_id%3D2482%2Aot_id%3D27743%2Atrend%3D19514%2Amarker%3D4154,"Debels L. May 8, 2023; Mo1062"
COMPARISON OF DIFFERENT LUMINAL STENTS FOR THE MANAGEMENT OF MALIGNANT STENOSIS,https://eposters.ddw.org/ddw/2023/ddw-2023/377642/fnu.deepali.comparison.of.different.luminal.stents.for.the.management.of.html?f=menu%3D16%2Abrowseby%3D8%2Asortby%3D2%2Ace_id%3D2482%2Aot_id%3D27743%2Atrend%3D19514%2Amarker%3D4154,"Deepali F. May 8, 2023; Mo1081"
EFFICACY AND TOLERABILITY OF 1-L POLYETHYLENE GLYCOL PLUS ASCORBIC ACID WITH SENNA VERSUS 2-L POLYETHYLENE...,https://eposters.ddw.org/ddw/2023/ddw-2023/379284/natsumi.maeda.efficacy.and.tolerability.of.1-l.polyethylene.glycol.plus.html?f=menu%3D16%2Abrowseby%3D8%2Asortby%3D2%2Ace_id%3D2482%2Aot_id%3D27743%2Atrend%3D19514%2Amarker%3D4154,"Maeda N. May 7, 2023; Su1062"
PROGNOSTIC NUTRITIONAL INDEX AS A NOVEL MARKER TO PREDICT BLEEDING AFTER ENDOSCOPIC SUBMUCOSAL DISSECTION FOR...,https://eposters.ddw.org/ddw/2023/ddw-2023/379285/shinji.yoshii.prognostic.nutritional.index.as.a.novel.marker.to.predict.html?f=menu%3D16%2Abrowseby%3D8%2Asortby%3D2%2Ace_id%3D2482%2Aot_id%3D27743%2Atrend%3D19514%2Amarker%3D4154,"Yoshii S. May 7, 2023; Su1063"
RANDOMIZED CONTROLLED TRIAL OF PROCEDURAL SEQUENCE FOR SAME-DAY BIDIRECTIONAL ENDOSCOPY UNDER MONITORED...,https://eposters.ddw.org/ddw/2023/ddw-2023/379286/ala.sharara.randomized.controlled.trial.of.procedural.sequence.for.same-day.html?f=menu%3D16%2Abrowseby%3D8%2Asortby%3D2%2Ace_id%3D2482%2Aot_id%3D27743%2Atrend%3D19514%2Amarker%3D4154,"Sharara A. May 7, 2023; Su1064"
HIGH-RISK POLYPS AT SCREENING COLONOSCOPY ARE ASSOCIATED WITH UPPER GASTROINTESTINAL CANCER MORTALITY,https://eposters.ddw.org/ddw/2023/ddw-2023/379294/jasmin.zessner-spitzenberg.high-risk.polyps.at.screening.colonoscopy.are.html?f=menu%3D16%2Abrowseby%3D8%2Asortby%3D2%2Ace_id%3D2482%2Aot_id%3D27743%2Atrend%3D19514%2Amarker%3D4154,"Zessner-Spitzenberg J. May 7, 2023; Su1072"
OUTCOMES OF DIRECT ENDOSCOPIC NECROSECTOMY WITH HYDROGEN PEROXIDE LAVAGE USING LUMEN APPOSING METAL STENTS FOR...,https://eposters.ddw.org/ddw/2023/ddw-2023/379297/rishi.pawa.outcomes.of.direct.endoscopic.necrosectomy.with.hydrogen.peroxide.html?f=menu%3D16%2Abrowseby%3D8%2Asortby%3D2%2Ace_id%3D2482%2Aot_id%3D27743%2Atrend%3D19514%2Amarker%3D4154,"Pawa R. May 7, 2023; Su1075"
DEVELOPMENT AND IMPLEMENTATION OF A CLINICAL DECISION SUPPORT TOOL TO IMPROVE ADHERENCE TO COLONOSCOPY FOLLOW-UP...,https://eposters.ddw.org/ddw/2023/ddw-2023/379298/brian.sullivan.development.and.implementation.of.a.clinical.decision.support.html?f=menu%3D16%2Abrowseby%3D8%2Asortby%3D2%2Ace_id%3D2482%2Aot_id%3D27743%2Atrend%3D19514%2Amarker%3D4154,"Sullivan B. May 7, 2023; Su1076"
VALIDATION OF POST-COLONOSCOPY COLORECTAL CANCER (PCCRC) CASES IN ENGLISH POPULATION DATA,https://eposters.ddw.org/ddw/2023/ddw-2023/379301/roland.valori.validation.of.post-colonoscopy.colorectal.cancer.28pccrc29.cases.html?f=menu%3D16%2Abrowseby%3D8%2Asortby%3D2%2Ace_id%3D2482%2Aot_id%3D27743%2Atrend%3D19514%2Amarker%3D4154,"Valori R. May 7, 2023; Su1079"
PERFORMANCE AND PREDICTORS OF FAILURE OF ENTERAL STENT PLACEMENT FOR MALIGNANT GASTRIC OUTLET OBSTRUCTION,https://eposters.ddw.org/ddw/2023/ddw-2023/379302/syedreza.haider.performance.and.predictors.of.failure.of.enteral.stent.html?f=menu%3D16%2Abrowseby%3D8%2Asortby%3D2%2Ace_id%3D2482%2Aot_id%3D27743%2Atrend%3D19514%2Amarker%3D4154,"Haider S. May 7, 2023; Su1080"
LIVING ON THE EDGE OF THE ESD SPECIMEN: CAUTERIZED MARGIN VS R0 RESECTION,https://eposters.ddw.org/ddw/2023/ddw-2023/379304/daniel.scanlon.living.on.the.edge.of.the.esd.specimen.cauterized.margin.vs.r0.html?f=menu%3D16%2Abrowseby%3D8%2Asortby%3D2%2Ace_id%3D2482%2Aot_id%3D27743%2Atrend%3D19514%2Amarker%3D4154,"Scanlon D. May 7, 2023; Su1082"
TIME-TO-ERCP FOR ASCENDING CHOLANGITIS DURING THE START OF THE COVID-19 PANDEMIC,https://eposters.ddw.org/ddw/2023/ddw-2023/379308/pedro.palacios.argueta.time-to-ercp.for.ascending.cholangitis.during.the.start.html?f=menu%3D16%2Abrowseby%3D8%2Asortby%3D2%2Ace_id%3D2482%2Aot_id%3D27743%2Atrend%3D19514%2Amarker%3D4154,"Palacios Argueta P. May 7, 2023; Su1086"
