RADIOIMMUNOTHERAPY OF AT-211-LABELED ANTI-FIBROBLAST GROWTH FACTOR RECEPTOR 4 (FGFR4) ANTIBODY IS A PROMISING...,https://eposters.ddw.org/ddw/2023/ddw-2023/380168/komei.kuge.radioimmunotherapy.of.at-211-labeled.anti-fibroblast.growth.factor.html?f=menu%3D16%2Abrowseby%3D8%2Asortby%3D2%2Ace_id%3D2482%2Aot_id%3D27743%2Atrend%3D19514%2Amarker%3D4154,"Kuge K. May 9, 2023; Tu1134"
THE DARK AGE OF SINGLE ORGAN SCREENING IS OVER: CD24 IS A NOVEL UNIVERSAL PAN-CANCER BLOOD TEST FOR EARLY...,https://eposters.ddw.org/ddw/2023/ddw-2023/380169/nadir.arber.the.dark.age.of.single.organ.screening.is.over.cd24.is.a.novel.html?f=menu%3D16%2Abrowseby%3D8%2Asortby%3D2%2Ace_id%3D2482%2Aot_id%3D27743%2Atrend%3D19514%2Amarker%3D4154,"Arber N. May 9, 2023; Tu1135"
HYPERMETHYLATION OF BCAT1 AND IKZF1 IS AN EARLY AND PERSISTING EVENT DURING COLORECTAL...,https://eposters.ddw.org/ddw/2023/ddw-2023/380170/jean.winter.hypermethylation.of.3Ci3Ebcat1.3C.i3Eand.3Ci3Eikzf13C.i3E.is.an.early.and.html?f=menu%3D16%2Abrowseby%3D8%2Asortby%3D2%2Ace_id%3D2482%2Aot_id%3D27743%2Atrend%3D19514%2Amarker%3D4154,"Winter J. May 9, 2023; Tu1136"
EXPRESSION PATTERN OF DNA DAMAGE RESPONSE PROTEIN 53BP1 ASSOCIATES WITH HISTOLOGICAL FEATURES OF HYPOPHARYNGEAL...,https://eposters.ddw.org/ddw/2023/ddw-2023/380171/maiko.tabuchi.expression.pattern.of.dna.damage.response.protein.53bp1.html?f=menu%3D16%2Abrowseby%3D8%2Asortby%3D2%2Ace_id%3D2482%2Aot_id%3D27743%2Atrend%3D19514%2Amarker%3D4154,"Tabuchi M. May 9, 2023; Tu1137"
SERUM TREFOIL FACTOR FAMILY 3 AS AN EFFECTIVE BIOMARKER FOR THE DETECTION OF ADVANCED COLORECTAL CANCER,https://eposters.ddw.org/ddw/2023/ddw-2023/380174/hyun.seok.lee.serum.trefoil.factor.family.3.as.an.effective.biomarker.for.the.html?f=menu%3D16%2Abrowseby%3D8%2Asortby%3D2%2Ace_id%3D2482%2Aot_id%3D27743%2Atrend%3D19514%2Amarker%3D4154,"Lee H. May 9, 2023; Tu1140"
ANALYSIS OF CIRCULATING TUMOR DNA FOR MALIGNANCIES SENT AT THE TIME OF ENDOSCOPIC VISUALIZATION: AN OPTIMAL...,https://eposters.ddw.org/ddw/2023/ddw-2023/380175/dawid.nowak.analysis.of.circulating.tumor.dna.for.malignancies.sent.at.the.html?f=menu%3D16%2Abrowseby%3D8%2Asortby%3D2%2Ace_id%3D2482%2Aot_id%3D27743%2Atrend%3D19514%2Amarker%3D4154,"Nowak D. May 9, 2023; Tu1141"
ESTROGEN RECEPTOR GPER AFFECTS THE PROGNOSIS OF GASTRIC CANCER BY REGULATING THE IMMUNE INFILTRATION AND ROS:...,https://eposters.ddw.org/ddw/2023/ddw-2023/380176/yang.xuefei.estrogen.receptor.gper.affects.the.prognosis.of.gastric.cancer.by.html?f=menu%3D16%2Abrowseby%3D8%2Asortby%3D2%2Ace_id%3D2482%2Aot_id%3D27743%2Atrend%3D19514%2Amarker%3D4154,"Xuefei Y. May 9, 2023; Tu1142"
HIGH DENSITY LIPOPROTEIN CHOLESTEROL REDUCES THE RISK OF GASTRIC CANCER MORTALITY,https://eposters.ddw.org/ddw/2023/ddw-2023/380177/su.youn.nam.high.density.lipoprotein.cholesterol.reduces.the.risk.of.gastric.html?f=menu%3D16%2Abrowseby%3D8%2Asortby%3D2%2Ace_id%3D2482%2Aot_id%3D27743%2Atrend%3D19514%2Amarker%3D4154,"Nam S. May 9, 2023; Tu1143"
EVALUATION OF GERIATRIC ASSESSMENT FOR ELDERLY PATIENTS WITH GASTROINTESTINAL OR BILIARY PANCREATIC CANCER WHO...,https://eposters.ddw.org/ddw/2023/ddw-2023/380178/yoshiyasu.kono.evaluation.of.geriatric.assessment.for.elderly.patients.with.html?f=menu%3D16%2Abrowseby%3D8%2Asortby%3D2%2Ace_id%3D2482%2Aot_id%3D27743%2Atrend%3D19514%2Amarker%3D4154,"Kono Y. May 9, 2023; Tu1144"
GROWTH ARREST-SPECIFIC 7 (GAS7) AS A NOVEL TUMOR SUPPRESOR GENE DURING COLON CARCINOGENESIS: IMPACT ON...,https://eposters.ddw.org/ddw/2023/ddw-2023/380179/sage.parker.growth.arrest-specific.7.28gas729.as.a.novel.tumor.suppresor.gene.html?f=menu%3D16%2Abrowseby%3D8%2Asortby%3D2%2Ace_id%3D2482%2Aot_id%3D27743%2Atrend%3D19514%2Amarker%3D4154,"Parker S. May 9, 2023; Tu1145"
GERMLINE AND SOMATIC VARIANTS ASSOCIATED WITH IMMUNE-CHECKPOINT INHIBITOR RELATED COLITIS,https://eposters.ddw.org/ddw/2023/ddw-2023/380180/sarah.abou.alaiwi.germline.and.somatic.variants.associated.with.html?f=menu%3D16%2Abrowseby%3D8%2Asortby%3D2%2Ace_id%3D2482%2Aot_id%3D27743%2Atrend%3D19514%2Amarker%3D4154,"Abou Alaiwi S. May 9, 2023; Tu1146"
LONGITUDINAL ASSESSMENT OF GASTRIC PREMALIGNANT CONDITIONS: HIGHER CONCORDANCE AND RISK PREDICTION OF THE OLGIM...,https://eposters.ddw.org/ddw/2023/ddw-2023/380164/arnoldo.riquelme.longitudinal.assessment.of.gastric.premalignant.conditions.html?f=menu%3D16%2Abrowseby%3D8%2Asortby%3D2%2Ace_id%3D2482%2Aot_id%3D27743%2Atrend%3D19514%2Amarker%3D4154,"Riquelme A. May 9, 2023; Tu1130"
COMBINATION OF LOW-COST SERUM BIOMARKERS YIELD EXCELLENT PREDICTIVE PERFORMANCE FOR THE NON-INVASIVE DETECTION...,https://eposters.ddw.org/ddw/2023/ddw-2023/380163/arnoldo.riquelme.combination.of.low-cost.serum.biomarkers.yield.excellent.html?f=menu%3D16%2Abrowseby%3D8%2Asortby%3D2%2Ace_id%3D2482%2Aot_id%3D27743%2Atrend%3D19514%2Amarker%3D4154,"Riquelme A. May 9, 2023; Tu1129"
EVALUATING DIFFERENT APPROACHES FOR CALCULATING ADENOMA DETECTION RATE: IS SCREENING COLONOSCOPY THE GOLD STANDARD?,https://eposters.ddw.org/ddw/2023/ddw-2023/380138/douglas.corley.evaluating.different.approaches.for.calculating.adenoma.html?f=menu%3D16%2Abrowseby%3D8%2Asortby%3D2%2Ace_id%3D2482%2Aot_id%3D27743%2Atrend%3D19514%2Amarker%3D4154,"Corley D. May 9, 2023; Tu1104"
ECONOMIC EVALUATION OF PERSONALIZED COLORECTAL CANCER SCREENING WITH DEEP MACHINE LEARNING,https://eposters.ddw.org/ddw/2023/ddw-2023/380128/pi-chun.chuang.economic.evaluation.of.personalized.colorectal.cancer.screening.html?f=menu%3D16%2Abrowseby%3D8%2Asortby%3D2%2Ace_id%3D2482%2Aot_id%3D27743%2Atrend%3D19514%2Amarker%3D4154,"Chuang P. May 9, 2023; Tu1094"
WAS THERE INCREASED INPATIENT GASTROSTOMY TUBE PLACEMENT DURING THE 2020 COVID-19 PANDEMIC?,https://eposters.ddw.org/ddw/2023/ddw-2023/380108/robert.christopher.chase.was.there.increased.inpatient.gastrostomy.tube.html?f=menu%3D16%2Abrowseby%3D8%2Asortby%3D2%2Ace_id%3D2482%2Aot_id%3D27743%2Atrend%3D19514%2Amarker%3D4154,"Chase R. May 9, 2023; Tu1074"
EFFECT OF CARDIAC AND PULMONARY DISEASE IN PATIENTS UNDERGOING RADIO-FREQUENCY ABLATION (RFA): A POPULATION...,https://eposters.ddw.org/ddw/2023/ddw-2023/380096/herman.suga.effect.of.cardiac.and.pulmonary.disease.in.patients.undergoing.html?f=menu%3D16%2Abrowseby%3D8%2Asortby%3D2%2Ace_id%3D2482%2Aot_id%3D27743%2Atrend%3D19514%2Amarker%3D4154,"Suga H. May 9, 2023; Tu1062"
PSYCHIATRIC COMORBIDITIES AT PRESENTATION IS ASSOCIATED WITH HIGHER BURDEN OF ESOPHAGEAL SYMPTOMS: A PROSPECTIVE...,https://eposters.ddw.org/ddw/2023/ddw-2023/377660/anton.de.witte.psychiatric.comorbidities.at.presentation.is.associated.with.html?f=menu%3D16%2Abrowseby%3D8%2Asortby%3D2%2Ace_id%3D2482%2Aot_id%3D27743%2Atrend%3D19514%2Amarker%3D4154,"De Witte A. May 8, 2023; Mo1099"
GLOBAL PERCEPTION OF NORMAL LIFE BY HEALTHCARE PROFESSIONALS AND IBD PATIENTS: MIND THE GAP,https://eposters.ddw.org/ddw/2023/ddw-2023/377661/joep.van.oostrom.global.perception.of.normal.life.by.healthcare.professionals.html?f=menu%3D16%2Abrowseby%3D8%2Asortby%3D2%2Ace_id%3D2482%2Aot_id%3D27743%2Atrend%3D19514%2Amarker%3D4154,"van Oostrom J. May 8, 2023; Mo1100"
EXPERIENCE-RELATED ASPECTS OF CARE: WHAT IS ACTUALLY MEASURED IN PATIENT-REPORTED INSTRUMENTS? A REVIEW.,https://eposters.ddw.org/ddw/2023/ddw-2023/377662/alan.lobo.experience-related.aspects.of.care.what.is.actually.measured.in.html?f=menu%3D16%2Abrowseby%3D8%2Asortby%3D2%2Ace_id%3D2482%2Aot_id%3D27743%2Atrend%3D19514%2Amarker%3D4154,"Lobo A. May 8, 2023; Mo1101"
VALIDATION OF THE LARYNGEAL HYPERVIGILANCE AND ANXIETY SCALE INSTRUMENT,https://eposters.ddw.org/ddw/2023/ddw-2023/377666/amanda.krause.validation.of.the.laryngeal.hypervigilance.and.anxiety.scale.html?f=menu%3D16%2Abrowseby%3D8%2Asortby%3D2%2Ace_id%3D2482%2Aot_id%3D27743%2Atrend%3D19514%2Amarker%3D4154,"Krause A. May 8, 2023; Mo1105"
PREVALENCE OF MEAL-RELATED GASTROINTESTINAL SYMPTOMS IN PATIENTS WITH A DISORDER OF GUT-BRAIN INTERACTION,https://eposters.ddw.org/ddw/2023/ddw-2023/377667/esther.colomier.prevalence.of.meal-related.gastrointestinal.symptoms.in.html?f=menu%3D16%2Abrowseby%3D8%2Asortby%3D2%2Ace_id%3D2482%2Aot_id%3D27743%2Atrend%3D19514%2Amarker%3D4154,"Colomier E. May 8, 2023; Mo1106"
A COMPARATIVE STUDY OF DISORDERS OF GUT-BRAIN INTERACTION IN WESTERN EUROPE AND ASIA BASED ON THE ROME...,https://eposters.ddw.org/ddw/2023/ddw-2023/377668/johann.hreinsson.a.comparative.study.of.disorders.of.gut-brain.interaction.in.html?f=menu%3D16%2Abrowseby%3D8%2Asortby%3D2%2Ace_id%3D2482%2Aot_id%3D27743%2Atrend%3D19514%2Amarker%3D4154,"Hreinsson J. May 8, 2023; Mo1107"
AGE DIFFERENCES IN CORE SYMPTOMS AND SYMPTOM RELATIONSHIPS IN PATIENTS WITH IRRITABLE BOWEL SYNDROME: A NETWORK...,https://eposters.ddw.org/ddw/2023/ddw-2023/377669/kendra.kamp.age.differences.in.core.symptoms.and.symptom.relationships.in.html?f=menu%3D16%2Abrowseby%3D8%2Asortby%3D2%2Ace_id%3D2482%2Aot_id%3D27743%2Atrend%3D19514%2Amarker%3D4154,"Kamp K. May 8, 2023; Mo1108"
EPIDEMIOLOGICAL AND DIET RELATED DIFFERENCES IN DISORDERS OF GUT-BRAIN INTERACTION (DGBI) IN 4 COUNTRIES OF...,https://eposters.ddw.org/ddw/2023/ddw-2023/377671/max.schmulson.wasserman.epidemiological.and.diet.related.differences.in.html?f=menu%3D16%2Abrowseby%3D8%2Asortby%3D2%2Ace_id%3D2482%2Aot_id%3D27743%2Atrend%3D19514%2Amarker%3D4154,"Schmulson Wasserman M. May 8, 2023; Mo1110"
EFFECTS ON QUALITY PERFORMANCE METRICS AFTER IMPLEMENTATION OF ANESTHESIA SERVICES IN A TERTIARY AMBULATORY...,https://eposters.ddw.org/ddw/2023/ddw-2023/377674/shajan.peter.effects.on.quality.performance.metrics.after.implementation.of.html?f=menu%3D16%2Abrowseby%3D8%2Asortby%3D2%2Ace_id%3D2482%2Aot_id%3D27743%2Atrend%3D19514%2Amarker%3D4154,"Peter S. May 8, 2023; Mo1113"
AN ANALYSIS OF THE OPEN PAYMENT CMS DATABASE FOR GASTROENTEROLOGY GUIDELINES AUTHORS IN THE LAST DECADE: A WORK...,https://eposters.ddw.org/ddw/2023/ddw-2023/377676/laith.numan.an.analysis.of.the.open.payment.cms.database.for.gastroenterology.html?f=menu%3D16%2Abrowseby%3D8%2Asortby%3D2%2Ace_id%3D2482%2Aot_id%3D27743%2Atrend%3D19514%2Amarker%3D4154,"Numan L. May 8, 2023; Mo1115"
"GENDER, USE OF ANTICOAGULANT AND PROLONGED USE ARE ASSOCIATED WITH FECAL MANAGEMENT SYSTEM RELATED COMPLICATIONS...",https://eposters.ddw.org/ddw/2023/ddw-2023/377677/manish.shrestha.gender.use.of.anticoagulant.and.prolonged.use.are.associated.html?f=menu%3D16%2Abrowseby%3D8%2Asortby%3D2%2Ace_id%3D2482%2Aot_id%3D27743%2Atrend%3D19514%2Amarker%3D4154,"Shrestha M. May 8, 2023; Mo1116"
PATIENT AND PUBLIC INVOLVEMENT (PPIN) IN IBD RESEARCH - A SYSTEMATIC REVIEW,https://eposters.ddw.org/ddw/2023/ddw-2023/377683/karam.elsolh.3Cbr3E.patient.and.public.involvement.28ppin29.in.ibd.research.-.a.html?f=menu%3D16%2Abrowseby%3D8%2Asortby%3D2%2Ace_id%3D2482%2Aot_id%3D27743%2Atrend%3D19514%2Amarker%3D4154,"Elsolh K. May 8, 2023; Mo1122"
OPTIMIZING PRIMARY CARE PHYSICIAN ATTRIBUTION STRATEGIES FOR HEALTH SYSTEM INTERVENTIONS TO INCREASE COLORECTAL...,https://eposters.ddw.org/ddw/2023/ddw-2023/377684/shailavi.jain.optimizing.primary.care.physician.attribution.strategies.for.html?f=menu%3D16%2Abrowseby%3D8%2Asortby%3D2%2Ace_id%3D2482%2Aot_id%3D27743%2Atrend%3D19514%2Amarker%3D4154,"Jain S. May 8, 2023; Mo1123"
FRQOL29 IS A USEFUL INSTRUMENT IN EVALUATION OF HISPANIC PATIENTS WITH IBD AND HIGHLIGHTS THE ASSOCIATION...,https://eposters.ddw.org/ddw/2023/ddw-2023/377651/gala.godoy.brewer.frqol29.is.a.useful.instrument.in.evaluation.of.hispanic.html?f=menu%3D16%2Abrowseby%3D8%2Asortby%3D2%2Ace_id%3D2482%2Aot_id%3D27743%2Atrend%3D19514%2Amarker%3D4154,"Godoy Brewer G. May 8, 2023; Mo1090"
PHASE 3 BIOMARKER STUDY FOR HCC SURVEILLANCE USING A NOVEL HES V2.0 ALGORITHM. A PROSPECTIVE COLLECTION WITH...,https://eposters.ddw.org/ddw/2023/ddw-2023/377690/hashem.el-serag.phase.3.biomarker.study.for.hcc.surveillance.using.a.novel.hes.html?f=menu%3D16%2Abrowseby%3D8%2Asortby%3D2%2Ace_id%3D2482%2Aot_id%3D27743%2Atrend%3D19514%2Amarker%3D4154,"El-Serag H. May 8, 2023; Mo1129"
SERUM METABOLIC BIOMARKER SIGNATURE IS PREDICTIVE OF THE RISK OF HEPATOCELLULAR CANCER IN PATIENTS WITH CIRRHOSIS,https://eposters.ddw.org/ddw/2023/ddw-2023/377691/hashem.el-serag.serum.metabolic.biomarker.signature.is.predictive.of.the.risk.html?f=menu%3D16%2Abrowseby%3D8%2Asortby%3D2%2Ace_id%3D2482%2Aot_id%3D27743%2Atrend%3D19514%2Amarker%3D4154,"El-Serag H. May 8, 2023; Mo1130"
SURVEILLANCE FOR PANCREATIC CANCER IN HIGH-RISK INDIVIDUALS LEADS TO IMPROVED OUTCOMES: A PROPENSITY...,https://eposters.ddw.org/ddw/2023/ddw-2023/377697/derk.klatte.surveillance.for.pancreatic.cancer.in.high-risk.individuals.leads.html?f=menu%3D16%2Abrowseby%3D8%2Asortby%3D2%2Ace_id%3D2482%2Aot_id%3D27743%2Atrend%3D19514%2Amarker%3D4154,"Klatte D. May 8, 2023; Mo1136"
IDENTIFICATION AND VALUE OF VOLATILE ORGANIC COMPOUNDS (VOCS) IN EXHALED BREATH TO DISTINGUISH PATIENTS WITH...,https://eposters.ddw.org/ddw/2023/ddw-2023/377701/nuttanit.pungpipattrakul.identification.and.value.of.volatile.organic.html?f=menu%3D16%2Abrowseby%3D8%2Asortby%3D2%2Ace_id%3D2482%2Aot_id%3D27743%2Atrend%3D19514%2Amarker%3D4154,"Pungpipattrakul N. May 8, 2023; Mo1140"
COLORECTAL CANCER IN MSH6 AND PMS2 LYNCH SYNDROME PATIENTS: CLINICAL PHENOTYPE IN A U.S. POPULATION,https://eposters.ddw.org/ddw/2023/ddw-2023/377710/tannaz.guivatchian.colorectal.cancer.in.msh6.and.pms2.lynch.syndrome.patients.html?f=menu%3D16%2Abrowseby%3D8%2Asortby%3D2%2Ace_id%3D2482%2Aot_id%3D27743%2Atrend%3D19514%2Amarker%3D4154,"Guivatchian T. May 8, 2023; Mo1149"
GERMLINE MUTATIONS IN EARLY-ONSET COLORECTAL CANCER: THE MORE YOU SEARCH THE MORE YOU FIND.,https://eposters.ddw.org/ddw/2023/ddw-2023/377713/jose.perea.germline.mutations.in.early-onset.colorectal.cancer.the.more.you.html?f=menu%3D16%2Abrowseby%3D8%2Asortby%3D2%2Ace_id%3D2482%2Aot_id%3D27743%2Atrend%3D19514%2Amarker%3D4154,"Perea J. May 8, 2023; Mo1152"
PROGRESSION TO DUODENAL SURGICAL RESECTION AMONG PATIENTS WITH FAMILIAL ADENOMATOUS POLYPOSIS UNDERGOING...,https://eposters.ddw.org/ddw/2023/ddw-2023/377721/hisham.wehbe.progression.to.duodenal.surgical.resection.among.patients.with.html?f=menu%3D16%2Abrowseby%3D8%2Asortby%3D2%2Ace_id%3D2482%2Aot_id%3D27743%2Atrend%3D19514%2Amarker%3D4154,"Wehbe H. May 8, 2023; Mo1160"
GUIDELINE COMPLIANCE AND OUTCOMES OF GENETIC TESTING IN PANCREATIC CANCER PATIENTS,https://eposters.ddw.org/ddw/2023/ddw-2023/377723/derk.klatte.guideline.compliance.and.outcomes.of.genetic.testing.in.pancreatic.html?f=menu%3D16%2Abrowseby%3D8%2Asortby%3D2%2Ace_id%3D2482%2Aot_id%3D27743%2Atrend%3D19514%2Amarker%3D4154,"Klatte D. May 8, 2023; Mo1162"
FAMILY HISTORY OF PANCREATIC CANCER: OUTCOMES OF A SINGLE CENTER GENETIC TESTING AND SCREENING PROGRAM,https://eposters.ddw.org/ddw/2023/ddw-2023/377725/alexis.bayudan.family.history.of.pancreatic.cancer.outcomes.of.a.single.center.html?f=menu%3D16%2Abrowseby%3D8%2Asortby%3D2%2Ace_id%3D2482%2Aot_id%3D27743%2Atrend%3D19514%2Amarker%3D4154,"Bayudan A. May 8, 2023; Mo1164"
DUODENAL LUMINAL MICROBIOME PROFILES EXHIBIT SEX-SPECIFIC DIFFERENCES,https://eposters.ddw.org/ddw/2023/ddw-2023/377729/mohamad.rashid.duodenal.luminal.microbiome.profiles.exhibit.sex-specific.html?f=menu%3D16%2Abrowseby%3D8%2Asortby%3D2%2Ace_id%3D2482%2Aot_id%3D27743%2Atrend%3D19514%2Amarker%3D4154,"Rashid M. May 8, 2023; Mo1168"
MICROBIOME BIOGEOGRAPHY ALONG THE GASTROINTESTINAL TRACT IS OBSERVED IN SPECIFIC PATHOGEN-FREE MICE AND IS...,https://eposters.ddw.org/ddw/2023/ddw-2023/377731/julianne.yang.microbiome.biogeography.along.the.gastrointestinal.tract.is.html?f=menu%3D16%2Abrowseby%3D8%2Asortby%3D2%2Ace_id%3D2482%2Aot_id%3D27743%2Atrend%3D19514%2Amarker%3D4154,"Yang J. May 8, 2023; Mo1170"
IMPACT OF PROLONGED INTAKE OF HEALING EARTH ON THE GUT MICROBIOTA OF PATIENTS WITH DIARRHEA-PREDOMINANT...,https://eposters.ddw.org/ddw/2023/ddw-2023/377733/riccardo.vasapolli.impact.of.prolonged.intake.of.healing.earth.on.the.gut.html?f=menu%3D16%2Abrowseby%3D8%2Asortby%3D2%2Ace_id%3D2482%2Aot_id%3D27743%2Atrend%3D19514%2Amarker%3D4154,"Vasapolli R. May 8, 2023; Mo1172"
TREATMENT SATISFACTION AND PREFERENCES IN CROHN’S PERIANAL FISTULAS: PATIENT AND HEALTHCARE PROFESSIONAL...,https://eposters.ddw.org/ddw/2023/ddw-2023/377659/bridgett.goodwin.treatment.satisfaction.and.preferences.in.crohns.perianal.html?f=menu%3D16%2Abrowseby%3D8%2Asortby%3D2%2Ace_id%3D2482%2Aot_id%3D27743%2Atrend%3D19514%2Amarker%3D4154,"Goodwin B. May 8, 2023; Mo1098"
"PATIENT AND PHYSICIAN PERSPECTIVES ON THE IMPACT OF CROHN'S PERIANAL FISTULAS ON PATIENT LIFE, UNMET NEEDS WITH...",https://eposters.ddw.org/ddw/2023/ddw-2023/377658/bridgett.goodwin.patient.and.physician.perspectives.on.the.impact.of.crohn.s.html?f=menu%3D16%2Abrowseby%3D8%2Asortby%3D2%2Ace_id%3D2482%2Aot_id%3D27743%2Atrend%3D19514%2Amarker%3D4154,"Goodwin B. May 8, 2023; Mo1097"
PATIENT-GASTROENTEROLOGIST DISCONNECT ON REMISSION STATUS AND SYMPTOM BURDEN IN ULCERATIVE COLITIS PATIENTS IN...,https://eposters.ddw.org/ddw/2023/ddw-2023/377655/myrlene.sanon.patient-gastroenterologist.disconnect.on.remission.status.and.html?f=menu%3D16%2Abrowseby%3D8%2Asortby%3D2%2Ace_id%3D2482%2Aot_id%3D27743%2Atrend%3D19514%2Amarker%3D4154,"Sanon M. May 8, 2023; Mo1094"
"""WHAT MATTERS TO YOU?"" - HOW DO PATIENT VIEWS COMPARE WITH A PATIENT EXPERIENCE FRAMEWORK AND UK NATIONAL...",https://eposters.ddw.org/ddw/2023/ddw-2023/377654/alan.lobo.what.matters.to.you.-.how.do.patient.views.compare.with.a.patient.html?f=menu%3D16%2Abrowseby%3D8%2Asortby%3D2%2Ace_id%3D2482%2Aot_id%3D27743%2Atrend%3D19514%2Amarker%3D4154,"Lobo A. May 8, 2023; Mo1093"
ENDOSCOPIC ACTIVITY AND ITS RELATIONSHIP TO PATIENT-RELEVANT OUTCOMES IN INFLAMMATORY BOWEL DISEASE: A...,https://eposters.ddw.org/ddw/2023/ddw-2023/377653/myrlene.sanon.endoscopic.activity.and.its.relationship.to.patient-relevant.html?f=menu%3D16%2Abrowseby%3D8%2Asortby%3D2%2Ace_id%3D2482%2Aot_id%3D27743%2Atrend%3D19514%2Amarker%3D4154,"Sanon M. May 8, 2023; Mo1092"
LONELINESS AND DEPRESSIVE SYMPTOMS ARE HIGH AMONG OLDER ADULTS WITH DIGESTIVE DISEASE DIAGNOSES AND ASSOCIATED...,https://eposters.ddw.org/ddw/2023/ddw-2023/377652/shirley.cohen-mekelburg.loneliness.and.depressive.symptoms.are.high.among.html?f=menu%3D16%2Abrowseby%3D8%2Asortby%3D2%2Ace_id%3D2482%2Aot_id%3D27743%2Atrend%3D19514%2Amarker%3D4154,"Cohen-Mekelburg S. May 8, 2023; Mo1091"
NON-ENDOSCOPIC DETECTION OF ESOPHAGEAL ADENOCARCINOMA USING NOVEL DNA METHYLATION BIOMARKER PANEL,https://eposters.ddw.org/ddw/2023/ddw-2023/377687/ke.ma.non-endoscopic.detection.of.esophageal.adenocarcinoma.using.novel.dna.html?f=menu%3D16%2Abrowseby%3D8%2Asortby%3D2%2Ace_id%3D2482%2Aot_id%3D27743%2Atrend%3D19514%2Amarker%3D4154,"Ma K. May 8, 2023; Mo1126"
CHANGE IN FATIGUE IN PATIENTS WITH ULCERATIVE COLITIS OR CROHN’S DISEASE INITIATING VEDOLIZUMAB OR OTHER...,https://eposters.ddw.org/ddw/2023/ddw-2023/377656/edouard.louis.change.in.fatigue.in.patients.with.ulcerative.colitis.or.crohns.html?f=menu%3D16%2Abrowseby%3D8%2Asortby%3D2%2Ace_id%3D2482%2Aot_id%3D27743%2Atrend%3D19514%2Amarker%3D4154,"Louis E. May 8, 2023; Mo1095"
BURDEN OF FLARES IN PATIENTS WITH ULCERATIVE COLITIS IN THE UNITED STATES – A REAL-WORLD STUDY,https://eposters.ddw.org/ddw/2023/ddw-2023/377657/ebuwa.igho-osagie.burden.of.flares.in.patients.with.ulcerative.colitis.in.the.html?f=menu%3D16%2Abrowseby%3D8%2Asortby%3D2%2Ace_id%3D2482%2Aot_id%3D27743%2Atrend%3D19514%2Amarker%3D4154,"Igho-Osagie E. May 8, 2023; Mo1096"
PHENOTYPIC CHARACTERIZATION OF GERD SYMPTOMS IN GASTROPARESIS VIA AUTOMATED DATA COLLECTION,https://eposters.ddw.org/ddw/2023/ddw-2023/377663/marialisa.itzoe.phenotypic.characterization.of.gerd.symptoms.in.gastroparesis.html?f=menu%3D16%2Abrowseby%3D8%2Asortby%3D2%2Ace_id%3D2482%2Aot_id%3D27743%2Atrend%3D19514%2Amarker%3D4154,"Itzoe M. May 8, 2023; Mo1102"
A SURVEY OF PERCEPTIONS OF INPATIENT PAIN MANAGEMENT AMONG HOSPITALIZED PATIENTS WITH INFLAMMATORY BOWEL DISEASE,https://eposters.ddw.org/ddw/2023/ddw-2023/377664/ariel.jordan.a.survey.of.perceptions.of.inpatient.pain.management.among.html?f=menu%3D16%2Abrowseby%3D8%2Asortby%3D2%2Ace_id%3D2482%2Aot_id%3D27743%2Atrend%3D19514%2Amarker%3D4154,"Jordan A. May 8, 2023; Mo1103"
VIRTUAL MINDFULNESS-BASED STRESS REDUCTION FOR ADULTS WITH INFLAMMATROY BOWEL DISEASE: FEASIBILITY TRIAL RESULTS,https://eposters.ddw.org/ddw/2023/ddw-2023/377665/kaitlyn.chappell.virtual.mindfulness-based.stress.reduction.for.adults.with.html?f=menu%3D16%2Abrowseby%3D8%2Asortby%3D2%2Ace_id%3D2482%2Aot_id%3D27743%2Atrend%3D19514%2Amarker%3D4154,"Chappell K. May 8, 2023; Mo1104"
SYMPTOMS OF AVOIDANT/RESTRICTIVE FOOD INTAKE DISORDER (ARFID) AND OTHER EATING DISORDERS IN ADULTS IN THE...,https://eposters.ddw.org/ddw/2023/ddw-2023/377670/amanda.blomsten.symptoms.of.avoidant.restrictive.food.intake.disorder.28arfid29.html?f=menu%3D16%2Abrowseby%3D8%2Asortby%3D2%2Ace_id%3D2482%2Aot_id%3D27743%2Atrend%3D19514%2Amarker%3D4154,"Blomsten A. May 8, 2023; Mo1109"
PREVALENCE AND IMPACT OF DISORDERS OF GUT-BRAIN INTERACTION (DGBI) IN THE SWEDISH GENERAL POPULATION,https://eposters.ddw.org/ddw/2023/ddw-2023/377672/navkiran.thind.tornkvist.prevalence.and.impact.of.disorders.of.gut-brain.html?f=menu%3D16%2Abrowseby%3D8%2Asortby%3D2%2Ace_id%3D2482%2Aot_id%3D27743%2Atrend%3D19514%2Amarker%3D4154,"Thind Tornkvist N. May 8, 2023; Mo1111"
TIME TO ENDOSCOPY FOR ESOPHAGEAL FOOD IMPACTION DOES NOT IMPACT COMPLICATIONS,https://eposters.ddw.org/ddw/2023/ddw-2023/377673/walker.redd.time.to.endoscopy.for.esophageal.food.impaction.does.not.impact.html?f=menu%3D16%2Abrowseby%3D8%2Asortby%3D2%2Ace_id%3D2482%2Aot_id%3D27743%2Atrend%3D19514%2Amarker%3D4154,"Redd W. May 8, 2023; Mo1112"
EFFECT OF INDICATION FOR COLONOSCOPY ON WITHDRAWAL TIME IN SUBJECTS WITH POSITIVE STOOL DNA TEST (COLOGUARD®),https://eposters.ddw.org/ddw/2023/ddw-2023/377675/elise.le.cam.effect.of.indication.for.colonoscopy.on.withdrawal.time.in.html?f=menu%3D16%2Abrowseby%3D8%2Asortby%3D2%2Ace_id%3D2482%2Aot_id%3D27743%2Atrend%3D19514%2Amarker%3D4154,"Le Cam E. May 8, 2023; Mo1114"
"USE OF A RADIOLOGY ""GI BUTTON"" FOR IDENTIFYING PANCREATIC LESIONS REQUIRING SURVEILLANCE: INITIAL REPORT OF A...",https://eposters.ddw.org/ddw/2023/ddw-2023/377678/shoheera.punjwani.use.of.a.radiology.gi.button.for.identifying.pancreatic.html?f=menu%3D16%2Abrowseby%3D8%2Asortby%3D2%2Ace_id%3D2482%2Aot_id%3D27743%2Atrend%3D19514%2Amarker%3D4154,"Punjwani S. May 8, 2023; Mo1117"
USING A CLINICAL DASHBOARD TO TRACK COLORECTAL CANCER SCREENING RATES AND MODALITIES IN A LARGE INTEGRATED...,https://eposters.ddw.org/ddw/2023/ddw-2023/377679/sadie.de.silva.using.a.clinical.dashboard.to.track.colorectal.cancer.screening.html?f=menu%3D16%2Abrowseby%3D8%2Asortby%3D2%2Ace_id%3D2482%2Aot_id%3D27743%2Atrend%3D19514%2Amarker%3D4154,"De Silva S. May 8, 2023; Mo1118"
CLINICAL CARE PROCESSES CAUSING DELAY FOR POSITIVE COLORECTAL CANCER SCREENING DIAGNOSTIC COLONOSCOPY AMONG...,https://eposters.ddw.org/ddw/2023/ddw-2023/377680/disha.kumar.clinical.care.processes.causing.delay.for.positive.colorectal.html?f=menu%3D16%2Abrowseby%3D8%2Asortby%3D2%2Ace_id%3D2482%2Aot_id%3D27743%2Atrend%3D19514%2Amarker%3D4154,"Kumar D. May 8, 2023; Mo1119"
IMPLEMENTATION OF A PERCUTANEOUS ENDOSCOPIC GASTROSTOMY CARE BUNDLE: A QUALITY IMPROVEMENT PROJECT,https://eposters.ddw.org/ddw/2023/ddw-2023/377681/hunter.dickson.implementation.of.a.percutaneous.endoscopic.gastrostomy.care.html?f=menu%3D16%2Abrowseby%3D8%2Asortby%3D2%2Ace_id%3D2482%2Aot_id%3D27743%2Atrend%3D19514%2Amarker%3D4154,"Dickson H. May 8, 2023; Mo1120"
IMPROVING SCREENING AND VACCINATION RATE FOR HEPATITIS B IN VETERANS AFFAIR PRIMARY CARE POPULATION: A QUALITY...,https://eposters.ddw.org/ddw/2023/ddw-2023/377682/zhuo.yu.improving.screening.and.vaccination.rate.for.hepatitis.b.in.veterans.html?f=menu%3D16%2Abrowseby%3D8%2Asortby%3D2%2Ace_id%3D2482%2Aot_id%3D27743%2Atrend%3D19514%2Amarker%3D4154,"Yu Z. May 8, 2023; Mo1121"
"REAL WORLD DATA USING ESOCHECK TM , A NON-ENDOSCOPIC ESOPHAGEAL CELL COLLECTION DEVICE FOR EARLY...",https://eposters.ddw.org/ddw/2023/ddw-2023/377685/suman.verma.real.world.data.using.esocheck3Csup3Etm3C.sup3E.a.non-endoscopic.html?f=menu%3D16%2Abrowseby%3D8%2Asortby%3D2%2Ace_id%3D2482%2Aot_id%3D27743%2Atrend%3D19514%2Amarker%3D4154,"VERMA S. May 8, 2023; Mo1124"
A CIRCULATING EXOSOMAL MICRORNA SIGNATURE FOR THE NONINVASIVE PREDICTION OF RESPONSE TO THE FIRST-LINE...,https://eposters.ddw.org/ddw/2023/ddw-2023/377686/keisuke.okuno.a.circulating.exosomal.microrna.signature.for.the.noninvasive.html?f=menu%3D16%2Abrowseby%3D8%2Asortby%3D2%2Ace_id%3D2482%2Aot_id%3D27743%2Atrend%3D19514%2Amarker%3D4154,"Okuno K. May 8, 2023; Mo1125"
THE CHARACTERISTICS AND OUTCOMES OF GASTROINTESTINAL STROMAL TUMOR WITH AND WITHOUT LIVER METASTASIS,https://eposters.ddw.org/ddw/2023/ddw-2023/377688/howard.chung.the.characteristics.and.outcomes.of.gastrointestinal.stromal.html?f=menu%3D16%2Abrowseby%3D8%2Asortby%3D2%2Ace_id%3D2482%2Aot_id%3D27743%2Atrend%3D19514%2Amarker%3D4154,"Chung H. May 8, 2023; Mo1127"
AN EXOSOMAL MIRNA-BASED LIQUID BIOPSY ASSAY FOR THE NONINVASIVE DIAGNOSTIC MARKER OF INTRAHEPATIC...,https://eposters.ddw.org/ddw/2023/ddw-2023/377689/katsuki.miyazaki.an.exosomal.mirna-based.liquid.biopsy.assay.for.the.html?f=menu%3D16%2Abrowseby%3D8%2Asortby%3D2%2Ace_id%3D2482%2Aot_id%3D27743%2Atrend%3D19514%2Amarker%3D4154,"Miyazaki K. May 8, 2023; Mo1128"
METHYLATED DNA MARKERS TO DIFFERENTIATE MALIGNANT FROM BENIGN BILIARY STRICTURES IN PATIENTS WITH PRIMARY...,https://eposters.ddw.org/ddw/2023/ddw-2023/377692/matt.cooley.methylated.dna.markers.to.differentiate.malignant.from.benign.html?f=menu%3D16%2Abrowseby%3D8%2Asortby%3D2%2Ace_id%3D2482%2Aot_id%3D27743%2Atrend%3D19514%2Amarker%3D4154,"Cooley M. May 8, 2023; Mo1131"
